{
  "name": "Radio Unit",
  "description": "Radio Unit configuration for Amarisoft/ORS",
  "serialisation": "json-in-xml",
  "software-type": {
    "default": {
      "title": "Defaul",
      "description": "RU configuration",
      "serialisation": "json-in-xml",
      "request":  "../ru/input-schema.json",
      "response": "../ru/input-schema.json",
      "index": 0
    }
  }
}
