{
  "description": "Caddy Frontend",
  "name": "Caddy Frontend",
  "serialisation": "xml",
  "software-type": {
    "custom-personal": {
      "description": "",
      "index": 2,
      "request": "instance-caddy-input-schema.json",
      "response": "instance-output-schema.json",
      "title": "Custom Personal"
    },
    "custom-personal-slave": {
      "description": "Custom Personal",
      "index": 1,
      "request": "instance-slave-caddy-input-schema.json",
      "response": "instance-output-schema.json",
      "shared": true,
      "software-type": "custom-personal",
      "title": "Custom Personal (Slave)"
    },
    "default": {
      "description": "Default",
      "index": 3,
      "request": "instance-caddy-input-schema.json",
      "response": "instance-output-schema.json",
      "software-type": "default",
      "title": "Default"
    },
    "default-slave": {
      "description": "Default",
      "index": 4,
      "request": "instance-slave-caddy-input-schema.json",
      "response": "instance-output-schema.json",
      "shared": true,
      "software-type": "default",
      "title": "Default (slave)"
    }
  }
}
