{
  "name": "Galene",
  "description": "Galene Video-conferencing",
  "serialisation": "json-in-xml",
  "software-type": {
    "default": {
      "title": "default",
      "software-type": "default",
      "description": "default",
      "request": "instance-ptt-default-input-schema.json",
      "response": "instance-ptt-default-output-schema.json",
      "index": 0
    }
  }
}
