{
    "name": "LTE",
    "description": "LTE",
    "serialisation": "json-in-xml",
    "software-type": {
        "enb": {
             "title": "eNB",
             "software-type": "enb",
             "description": "eNodeB Configuration",
             "request": "instance-enb-input-schema.json",
             "response": "instance-enb-schema.json",
             "index": 0
         },
        "epc": {
             "title": "EPC",
             "software-type": "epc",
             "description": "EPC Configuration",
             "request": "instance-epc-input-schema.json",
             "response": "instance-epc-schema.json",
             "index": 1
         },
        "ims": {
             "title": "IMS",
             "software-type": "ims",
             "description": "IMS Configuration",
             "request": "instance-ims-input-schema.json",
             "response": "instance-ims-schema.json",
             "index": 2
         },
        "default": {
            "title": "Default",
            "software-type": "default",
            "description": "Default",
            "request": "instance-lte-input-schema.json",
            "response": "instance-lte-schema.json",
            "index": 3
        }
    }
}
