{
  "name": "Wendelin",
  "description": "Wendelin",
  "serialisation": "json-in-xml",
  "software-type": {
    "default": {
      "title": "Default",
      "software-type": "default",
      "request": "instance-wendelin-input-schema.json",
      "response": "instance-wendelin-output-schema.json",
      "index": 0
    }
  }
}
