{
  "name": "Amarisoft stack",
  "description": "4G and 5G amarisoft stack",
  "serialisation": "json-in-xml",
  "software-type": {
    "enb": {
      "title": "eNB/gNB",
      "software-type": "enb",
      "description": "eNodeB/gNodeB Configuration",
      "request": "instance-enb-input-schema.json",
      "response": "instance-enb-schema.json",
      "index": 1
    },
    "core-network": {
      "title": "Core Network",
      "software-type": "core-network",
      "description": "Core Network Configuration",
      "request": "instance-core-network-input-schema.json",
      "response": "instance-core-network-schema.json",
      "index": 2
    },
    "core-network-slave": {
      "title": "â†’ Core Network | Sim Card",
      "description": "Core Network Sim Card Configuration",
      "software-type": "core-network",
      "request": "sim/input-schema.json",
      "response": "sim/schema.json",
      "shared": true,
      "index": 3
    },
    "ue": {
      "title": "UE",
      "description": "UE Configuration",
      "software-type": "ue",
      "request": "instance-ue-input-schema.json",
      "response": "instance-ue-schema.json",
      "index": 4
    }
  }
}
