{
  "name": "Monitor",
  "description": "Software release for Monitoring purpose",
  "serialisation": "xml",
  "software-type": {
    "default": {
      "title": "Default",
      "description": "Standalone Monitor",
      "request": "instance-default-input-schema.json",
      "response": "instance-default-output-schema.json",
      "index": 0
    },
    "edgetest-basic": {
      "title": "Edge Test Basic",
      "description": "Basic URL monitoring configuration",
      "request": "instance-edgetest-basic-input-schema.json",
      "response": "instance-edgetest-basic-output-schema.json",
      "serialisation": "json-in-xml",
      "index": 1
    },
    "edgetest": {
      "title": "Edge Test Shared Cluster [OBSOLETE]",
      "description": "Cluster of bots to perform a distributed monitoring with shared instances. OBSOLETE: Overcomplicated, use Edge Test Basic..",
      "request": "instance-edgetest-input-schema.json",
      "response": "instance-default-output-schema.json",
      "serialisation": "json-in-xml",
      "index": 3
    },
    "edgetest-slave": {
      "title": "Edge Test Shared Instance [OBSOLETE]",
      "shared": true,
      "software-type": "edgetest",
      "description": "Definition of monitorig for Edge Test Shared Cluster. OBSOLETE: Overcomplicated, use Edge Test Basic.",
      "request": "instance-edgetest-slave-input-schema.json",
      "response": "instance-default-output-schema.json",
      "serialisation": "json-in-xml",
      "index": 4
    }
  }
}
