{
  "name": "Gitea",
  "description": "Gitea",
  "serialisation": "json-in-xml",
  "software-type": {
    "default": {
      "title": "Default",
      "description": "Gitea",
      "request": "instance-input-schema.json",
      "response": "instance-output-schema.json",
      "index": 0
    }
  }
}
