{
  "name": "Mail Server",
  "description": "Mail Server",
  "serialisation": "json-in-xml",
  "software-type": {
    "cluster": {
      "title": "Mail Server Cluster",
      "software-type": "cluster",
      "request": "instance-cluster-input-schema.json",
      "response": "instance-cluster-output-schema.json",
      "index": 0
    },
    "cluster-slave": {
      "title": "Mail Server Cluster Slave",
      "software-type": "cluster",
      "request": "instance-slave-input-schema.json",
      "response": "instance-slave-output-schema.json",
      "shared": true,
      "index": 1
    },
    "relay": {
      "title": "Mail Server Relay",
      "software-type": "relay",
      "request": "instance-relay-input-schema.json",
      "response": "instance-relay-output-schema.json",
      "index": 2
    },
    "omailgw": {
      "title": "oMailGw API/UI",
      "software-type": "omailgw",
      "request": "instance-omailgw-input-schema.json",
      "response": "instance-omailgw-output-schema.json",
      "index": 3
    }
  }
}
