{
  "name": "ERP5",
  "description": "ERP5, Open-Source ERP",
  "serialisation": "json-in-xml",
  "software-type": {
    "default": {
      "title": "Default",
      "software-type": "default",
      "request": "instance-dovecot-input-schema.json",
      "response": "instance-dovecot-output-schema.json",
      "index": 0
    }
  }
}
