{
  "name": "Simpleran",
  "description": "4G and 5G amarisoft stack for ORS",
  "serialisation": "json-in-xml",
  "software-type": {
    "enb-gnb": {
      "title": "eNB / gNB",
      "software-type": "enb-gnb",
      "description": "eNodeB / gNodeB Configuration",
      "request": "instance-ors-enb-gnb-input-schema.json",
      "response": "instance-ors-enb-schema.json",
      "index": 1
    },
    "enb": {
      "title": "eNB / gNB (obsolete)",
      "software-type": "enb",
      "description": "eNodeB / gNodeB Configuration",
      "request": "instance-ors-enb-gnb-input-schema.json",
      "response": "instance-ors-enb-schema.json",
      "index": 2
    },
    "gnb": {
      "title": "eNB / gNB (obsolete)",
      "software-type": "gnb",
      "description": "eNodeB / gNodeB Configuration",
      "request": "instance-ors-enb-gnb-input-schema.json",
      "response": "instance-ors-enb-schema.json",
      "index": 3
    },
    "ue": {
      "title": "UE",
      "software-type": "ue",
      "description": "User Equipment Configuration",
      "request": "instance-ors-ue-input-schema.json",
      "response": "instance-ors-ue-schema.json",
      "index": 4
    },
    "core-network": {
      "title": "Core Network",
      "software-type": "core-network",
      "description": "Core Network Configuration",
      "request": "instance-core-network-input-schema.json",
      "response": "instance-core-network-schema.json",
      "index": 5
    },
    "core-network-slave": {
      "title": "SIM Card",
      "description": "SIM Card",
      "software-type": "core-network",
      "request": "core-network-shared-input-schema.json",
      "response": "sim/schema.json",
      "shared": true,
      "index": 6
    },
    "test-model": {
      "title": "Test Model",
      "software-type": "test-model",
      "description": "Play 3GPP Test Models, allows to measure power or radio quality",
      "request": "instance-test-model-input-schema.json",
      "response": "instance-test-model-schema.json",
      "index": 7
    }
  }
}
